{
  "schema_version": "1.1.0",
  "last_completed_pr": "PR-OPS-01",
  "next_pr": "PR-DOCS-01",
  "active_phase": "Phase 0 Track A",
  "last_invocation": "2026-03-05",
  "blocked_reason": null,
  "blocked_at_gate": null,
  "blocked_at_tier": null,
  "last_gate_results": {
    "tier_0": "pass",
    "tier_1": "pass",
    "tier_2": "pass",
    "tier_3": "not_run"
  },
  "open_findings": [],
  "value_checkpoints_reached": [
    "phase0-track-a-hardening",
    "pr-lint-01-determinism-orchestrator",
    "pr-harden-01-boot-env-signing-key",
    "pr-security-01-federation-key-pinning",
    "pr-perf-01-streaming-lineage-ledger",
    "pr-ops-01-snapshot-atomicity"
  ],
  "pending_evidence_rows": []
}
